{
  "schema": "vland.spawn.plan",
  "schemaVersion": 4,
  "sceneFingerprint": "a6721220",
  "stateChecksum": "bd7d632d",
  "context": {
    "clock": {
      "seconds": 0,
      "turns": 0
    },
    "phase": "day",
    "activeLayerIds": [
      "surface",
      "cave-1"
    ],
    "activeSourceIds": [
      "forest",
      "deer-habitat",
      "iron-deposits",
      "cave-population",
      "encounter",
      "one-chest",
      "one-portal",
      "guard-spawner"
    ],
    "enteredSourceIds": [],
    "nearbySourceIds": [],
    "signals": [],
    "flags": {},
    "occupied": []
  },
  "commands": [
    {
      "id": "spawn-01c60ba44d4dba72",
      "catalogId": "deer",
      "layerId": "surface",
      "x": 7,
      "y": 31,
      "properties": {},
      "origin": {
        "sourceId": "deer-habitat",
        "ruleId": "population",
        "index": 0
      }
    },
    {
      "id": "spawn-45c2a5197d846ce5",
      "catalogId": "deer",
      "layerId": "surface",
      "x": 32,
      "y": 29,
      "properties": {},
      "origin": {
        "sourceId": "deer-habitat",
        "ruleId": "population",
        "index": 1
      }
    },
    {
      "id": "spawn-45c06682036e4ef0",
      "catalogId": "deer",
      "layerId": "surface",
      "x": 38,
      "y": 30,
      "properties": {},
      "origin": {
        "sourceId": "deer-habitat",
        "ruleId": "population",
        "index": 2
      }
    },
    {
      "id": "spawn-01bdbcdf84beee2b",
      "catalogId": "deer",
      "layerId": "surface",
      "x": 12,
      "y": 23,
      "properties": {},
      "origin": {
        "sourceId": "deer-habitat",
        "ruleId": "population",
        "index": 3
      }
    },
    {
      "id": "spawn-01cf0600c56f9a0e",
      "catalogId": "deer",
      "layerId": "surface",
      "x": 12,
      "y": 20,
      "properties": {},
      "origin": {
        "sourceId": "deer-habitat",
        "ruleId": "population",
        "index": 4
      }
    },
    {
      "id": "spawn-05cccdb590be4781",
      "catalogId": "deer",
      "layerId": "surface",
      "x": 17,
      "y": 2,
      "properties": {},
      "origin": {
        "sourceId": "deer-habitat",
        "ruleId": "population",
        "index": 5
      }
    },
    {
      "id": "spawn-18bfb12de1cd97c1",
      "catalogId": "shrub",
      "layerId": "surface",
      "x": 23,
      "y": 7,
      "properties": {},
      "origin": {
        "sourceId": "forest",
        "ruleId": "population",
        "index": 0
      }
    },
    {
      "id": "spawn-14c1e978b813487a",
      "catalogId": "oak",
      "layerId": "surface",
      "x": 21,
      "y": 7,
      "properties": {},
      "origin": {
        "sourceId": "forest",
        "ruleId": "population",
        "index": 1
      }
    },
    {
      "id": "spawn-14bb2db318be8bcf",
      "catalogId": "oak",
      "layerId": "surface",
      "x": 23,
      "y": 9,
      "properties": {},
      "origin": {
        "sourceId": "forest",
        "ruleId": "population",
        "index": 2
      }
    },
    {
      "id": "spawn-d8bd0dd6e3283eb8",
      "catalogId": "shrub",
      "layerId": "surface",
      "x": 23,
      "y": 3,
      "properties": {},
      "origin": {
        "sourceId": "forest",
        "ruleId": "population",
        "index": 3
      }
    },
    {
      "id": "spawn-d8b65211b1b804bd",
      "catalogId": "shrub",
      "layerId": "surface",
      "x": 23,
      "y": 0,
      "properties": {},
      "origin": {
        "sourceId": "forest",
        "ruleId": "population",
        "index": 4
      }
    },
    {
      "id": "spawn-14b8ef1c8d031066",
      "catalogId": "oak",
      "layerId": "surface",
      "x": 21,
      "y": 3,
      "properties": {},
      "origin": {
        "sourceId": "forest",
        "ruleId": "population",
        "index": 5
      }
    },
    {
      "id": "spawn-14b0a057afc14abb",
      "catalogId": "shrub",
      "layerId": "surface",
      "x": 23,
      "y": 5,
      "properties": {},
      "origin": {
        "sourceId": "forest",
        "ruleId": "population",
        "index": 6
      }
    },
    {
      "id": "spawn-d8b4137a9fdb8ce4",
      "catalogId": "oak",
      "layerId": "surface",
      "x": 8,
      "y": 0,
      "properties": {},
      "origin": {
        "sourceId": "forest",
        "ruleId": "population",
        "index": 7
      }
    },
    {
      "id": "spawn-18d338e547219399",
      "catalogId": "oak",
      "layerId": "surface",
      "x": 7,
      "y": 1,
      "properties": {},
      "origin": {
        "sourceId": "forest",
        "ruleId": "population",
        "index": 8
      }
    },
    {
      "id": "spawn-d4d69f70005c4bd2",
      "catalogId": "shrub",
      "layerId": "surface",
      "x": 8,
      "y": 2,
      "properties": {},
      "origin": {
        "sourceId": "forest",
        "ruleId": "population",
        "index": 9
      }
    },
    {
      "id": "spawn-968a9ce61490cb1a",
      "catalogId": "shrub",
      "layerId": "surface",
      "x": 7,
      "y": 31,
      "properties": {},
      "origin": {
        "sourceId": "forest",
        "ruleId": "population",
        "index": 10
      }
    },
    {
      "id": "spawn-92885803aa6bf761",
      "catalogId": "shrub",
      "layerId": "surface",
      "x": 9,
      "y": 30,
      "properties": {},
      "origin": {
        "sourceId": "forest",
        "ruleId": "population",
        "index": 11
      }
    },
    {
      "id": "spawn-928f13c84a096f58",
      "catalogId": "shrub",
      "layerId": "surface",
      "x": 4,
      "y": 31,
      "properties": {},
      "origin": {
        "sourceId": "forest",
        "ruleId": "population",
        "index": 12
      }
    },
    {
      "id": "spawn-d68d403d727bca6f",
      "catalogId": "shrub",
      "layerId": "surface",
      "x": 5,
      "y": 30,
      "properties": {},
      "origin": {
        "sourceId": "forest",
        "ruleId": "population",
        "index": 13
      }
    },
    {
      "id": "spawn-96800f8a4e37c086",
      "catalogId": "oak",
      "layerId": "surface",
      "x": 7,
      "y": 5,
      "properties": {},
      "origin": {
        "sourceId": "forest",
        "ruleId": "population",
        "index": 14
      }
    },
    {
      "id": "spawn-927dcaa7fb94625d",
      "catalogId": "shrub",
      "layerId": "surface",
      "x": 8,
      "y": 6,
      "properties": {},
      "origin": {
        "sourceId": "forest",
        "ruleId": "population",
        "index": 15
      }
    },
    {
      "id": "spawn-d284eb2c7a847b84",
      "catalogId": "oak",
      "layerId": "surface",
      "x": 6,
      "y": 3,
      "properties": {},
      "origin": {
        "sourceId": "forest",
        "ruleId": "population",
        "index": 16
      }
    },
    {
      "id": "spawn-d682b2e1f8bfbc5b",
      "catalogId": "shrub",
      "layerId": "surface",
      "x": 7,
      "y": 9,
      "properties": {},
      "origin": {
        "sourceId": "forest",
        "ruleId": "population",
        "index": 17
      }
    },
    {
      "id": "spawn-d69e895ecc290a72",
      "catalogId": "shrub",
      "layerId": "surface",
      "x": 6,
      "y": 10,
      "properties": {},
      "origin": {
        "sourceId": "forest",
        "ruleId": "population",
        "index": 18
      }
    },
    {
      "id": "spawn-d29c447ba96cba39",
      "catalogId": "shrub",
      "layerId": "surface",
      "x": 9,
      "y": 9,
      "properties": {},
      "origin": {
        "sourceId": "forest",
        "ruleId": "population",
        "index": 19
      }
    },
    {
      "id": "spawn-8bd6083b5784c1f9",
      "catalogId": "oak",
      "layerId": "surface",
      "x": 11,
      "y": 9,
      "properties": {},
      "origin": {
        "sourceId": "forest",
        "ruleId": "population",
        "index": 20
      }
    },
    {
      "id": "spawn-8fd84d1e51d51732",
      "catalogId": "shrub",
      "layerId": "surface",
      "x": 12,
      "y": 11,
      "properties": {},
      "origin": {
        "sourceId": "forest",
        "ruleId": "population",
        "index": 21
      }
    },
    {
      "id": "spawn-4fdbb9f53e72c8e7",
      "catalogId": "shrub",
      "layerId": "surface",
      "x": 10,
      "y": 11,
      "properties": {},
      "origin": {
        "sourceId": "forest",
        "ruleId": "population",
        "index": 22
      }
    },
    {
      "id": "spawn-4bddf24026209290",
      "catalogId": "shrub",
      "layerId": "surface",
      "x": 12,
      "y": 7,
      "properties": {},
      "origin": {
        "sourceId": "forest",
        "ruleId": "population",
        "index": 23
      }
    },
    {
      "id": "spawn-2e33661229576d4a",
      "catalogId": "guard",
      "layerId": "surface",
      "x": 30,
      "y": 2,
      "properties": {},
      "origin": {
        "sourceId": "guard-spawner",
        "ruleId": "population",
        "index": 0
      }
    },
    {
      "id": "spawn-21964830c11fde40",
      "catalogId": "iron",
      "layerId": "cave-1",
      "x": 8,
      "y": 27,
      "properties": {
        "depositId": "deposit-bfb44a8f",
        "amount": 51
      },
      "origin": {
        "sourceId": "iron-deposits",
        "ruleId": "population",
        "index": 0
      }
    },
    {
      "id": "spawn-659474a538aa55d5",
      "catalogId": "iron",
      "layerId": "cave-1",
      "x": 8,
      "y": 26,
      "properties": {
        "depositId": "deposit-bfb44a8f",
        "amount": 32
      },
      "origin": {
        "sourceId": "iron-deposits",
        "ruleId": "population",
        "index": 1
      }
    },
    {
      "id": "spawn-6592360e9fd586d2",
      "catalogId": "iron",
      "layerId": "cave-1",
      "x": 9,
      "y": 27,
      "properties": {
        "depositId": "deposit-bfb44a8f",
        "amount": 45
      },
      "origin": {
        "sourceId": "iron-deposits",
        "ruleId": "population",
        "index": 2
      }
    },
    {
      "id": "spawn-218f8c6bd54e5e7f",